{
  "formatVersion": 1,
  "modes": ["light", "dark"],
  "defaultMode": "light",
  "tokens": {
    "button.background": {
      "visibility": "public",
      "valueByMode": {
        "light": {
          "colorSpace": "srgb",
          "r": 0.4,
          "g": 0.31,
          "b": 0.64,
          "alpha": 1
        },
        "dark": {
          "colorSpace": "srgb",
          "r": 0.82,
          "g": 0.74,
          "b": 1,
          "alpha": 1
        }
      },
      "origin": {
        "kind": "graph"
      },
      "dependenciesByMode": {
        "light": ["brand.primary"],
        "dark": ["brand.primary"]
      }
    },
    "button.foreground": {
      "visibility": "public",
      "valueByMode": {
        "light": {
          "colorSpace": "srgb",
          "r": 1,
          "g": 1,
          "b": 1,
          "alpha": 1
        },
        "dark": {
          "colorSpace": "srgb",
          "r": 0.22,
          "g": 0.12,
          "b": 0.45,
          "alpha": 1
        }
      },
      "origin": {
        "kind": "graph"
      },
      "dependenciesByMode": {
        "light": ["brand.on-primary"],
        "dark": ["brand.on-primary"]
      }
    }
  }
}
